{
  "meta": {
    "projeto": "Projeto Caserna de Adulão",
    "programa": "Discipulando a Caserna",
    "versao": "0.1.0-candidate",
    "status": "EM REVISAO",
    "data": "2026-08-05",
    "direcao": "A — Prospecto pastoral editorial",
    "fraseDirecaoStatus": "CANDIDATA — aguarda D3-02 / V2",
    "fonteIdentidade": "conteudo/identidade.md (Guia Mestre §1.6); logo-pdac/LEIA-ME.md (aliases)",
    "fonteHumanaBrand": "design-system/docs/brand-guidelines.md",
    "fonteVerdade": "tokens.json",
    "formato": "ME-T",
    "contratoVersao": "1.0",
    "unidadeEspacamentoBase": "4px",
    "notacaoCor": "hex",
    "politicaFallback": "hex-first; oklch opcional somente se equivalência sRGB validada",
    "autoria": "Fase 3 — O Sistema (candidato)",
    "compatibilidade": "Protótipos não migrados; ver compat.legado",
    "arquivosGerados": ["tokens.css"],
    "auditoriaBrandBook": "2026-08-05 — paleta/tipo/motion alinhados a guidelines; bronze-500 Guia vs bronze-600 logo (H1); camada componente permanece fora do JSON (contratos dc-*)",
    "dtcgNota": "Folhas tipadas alinhadas ao DTCG 2025.10 Community Group Report (não W3C Recommendation). Camadas PT primitivos/semanticos; sem componentes."
  },
  "primitivos": {
    "cor": {
      "navy": {
        "50": {
          "$value": "#E8ECF2",
          "$type": "color",
          "$description": "Navy muito claro — raramente superfície; apoio de escala",
          "$origem": "derivado de #1A2A44"
        },
        "100": {
          "$value": "#C5CEDC",
          "$type": "color",
          "$description": "Navy claro",
          "$origem": "derivado",
          "$metodoDerivacao": "PENDENTE HUMANO — sem fórmula/tool reproduzível registrada (F3-R05)"
        },
        "300": {
          "$value": "#6B7F9C",
          "$type": "color",
          "$description": "Navy médio",
          "$origem": "derivado",
          "$metodoDerivacao": "PENDENTE HUMANO — sem fórmula/tool reproduzível registrada (F3-R05)"
        },
        "600": {
          "$value": "#243656",
          "$type": "color",
          "$description": "Navy intermediário (estudo Dir B)",
          "$origem": "direcao-b legado / escala"
        },
        "800": {
          "$value": "#1A2A44",
          "$type": "color",
          "$description": "Navy âncora — superfície profunda",
          "$origem": "identidade.md"
        },
        "900": {
          "$value": "#101D33",
          "$type": "color",
          "$description": "Navy escuro — profundidade máxima",
          "$origem": "identidade.md"
        }
      },
      "bronze": {
        "100": {
          "$value": "#E8D9C0",
          "$type": "color",
          "$description": "Bronze muito claro",
          "$origem": "derivado de #8C6A45"
        },
        "300": {
          "$value": "#C9A86A",
          "$type": "color",
          "$description": "Bronze claro — foco e acento sobre navy",
          "$origem": "prospecto --bronze-cl (candidato)"
        },
        "500": {
          "$value": "#8C6A45",
          "$type": "color",
          "$description": "Bronze canônico — acento editorial (D3-05 default)",
          "$origem": "identidade.md"
        },
        "600": {
          "$value": "#8C6A46",
          "$type": "color",
          "$description": "Latão logo — alias perceptivo de 500",
          "$origem": "logo-pdac LEIA-ME"
        },
        "700": {
          "$value": "#7C6038",
          "$type": "color",
          "$description": "Bronze escuro — texto/acento sobre papel quando 500 falha contraste",
          "$origem": "prospecto --bronze-esc"
        },
        "legadoProspecto": {
          "$value": "#9A7B4F",
          "$type": "color",
          "$description": "Bronze prospecto v1 — LEGADO; não usar em semânticos novos",
          "$origem": "prospecto tokens.css"
        }
      },
      "neutroQuente": {
        "0": {
          "$value": "#FBF8F2",
          "$type": "color",
          "$description": "Papel — superfície principal de leitura",
          "$origem": "prospecto --papel"
        },
        "50": {
          "$value": "#F5F1E7",
          "$type": "color",
          "$description": "Creme — caixas e blocos",
          "$origem": "identidade.md"
        },
        "100": {
          "$value": "#F4F4F1",
          "$type": "color",
          "$description": "Base storytelling / logo 1C negativa — legado de superfície",
          "$origem": "logo-pdac / storytelling --base"
        },
        "200": {
          "$value": "#C9BCA1",
          "$type": "color",
          "$description": "Régua — filetes e divisórias",
          "$origem": "identidade.md"
        },
        "400": {
          "$value": "#5B5349",
          "$type": "color",
          "$description": "Taupe de apoio (logo kit)",
          "$origem": "logo-pdac"
        },
        "500": {
          "$value": "#4A4A4A",
          "$type": "color",
          "$description": "Estrutural / 1C positiva",
          "$origem": "logo-pdac / storytelling --estrut"
        },
        "700": {
          "$value": "#2B2B2B",
          "$type": "color",
          "$description": "Chumbo storytelling — legado vs tinta",
          "$origem": "storytelling --chumbo"
        },
        "800": {
          "$value": "#23262B",
          "$type": "color",
          "$description": "Tinta — texto corrido",
          "$origem": "identidade.md"
        },
        "950": {
          "$value": "#111418",
          "$type": "color",
          "$description": "Sombra / chumbo profundo — elevação, não navy",
          "$origem": "storytelling --sombra"
        }
      },
      "estado": {
        "sucesso": {
          "$value": "#2F5D3A",
          "$type": "color",
          "$description": "Sucesso dessaturado (Dir C ok) — nunca único portador",
          "$origem": "direcao-c"
        },
        "aviso": {
          "$value": "#7A5A28",
          "$type": "color",
          "$description": "Aviso quente contido",
          "$origem": "direcao-c pend"
        },
        "erro": {
          "$value": "#6B2E2E",
          "$type": "color",
          "$description": "Erro contido — não alarme comercial",
          "$origem": "derivado editorial"
        },
        "informacao": {
          "$value": "#3D4F66",
          "$type": "color",
          "$description": "Informação alinhada ao navy",
          "$origem": "derivado navy"
        }
      }
    },
    "tipografia": {
      "familiaDisplay": {
        "$value": "\"Montserrat\", sans-serif",
        "$type": "fontFamily",
        "$description": "Display / rótulos — pesos 700–800 locais"
      },
      "familiaCorpo": {
        "$value": "\"Source Serif 4\", \"Source Serif Pro\", Georgia, serif",
        "$type": "fontFamily",
        "$description": "Prosa de leitura — 400/400i/600 locais"
      },
      "familiaFallbackSistemaSerif": {
        "$value": "\"Iowan Old Style\", \"Palatino Linotype\", Palatino, Georgia, serif",
        "$type": "fontFamily",
        "$description": "LEGADO storytelling — fallback, não canônico"
      },
      "familiaFallbackSistemaSans": {
        "$value": "\"Helvetica Neue\", Helvetica, Arial, system-ui, sans-serif",
        "$type": "fontFamily",
        "$description": "LEGADO storytelling — fallback"
      },
      "escala": {
        "xs": {
          "$value": "clamp(0.75rem, 0.7rem + 0.2vw, 0.8125rem)",
          "$type": "dimension"
        },
        "sm": {
          "$value": "clamp(0.875rem, 0.82rem + 0.25vw, 0.9375rem)",
          "$type": "dimension"
        },
        "base": {
          "$value": "clamp(1.0625rem, 1rem + 0.35vw, 1.1875rem)",
          "$type": "dimension"
        },
        "md": {
          "$value": "clamp(1.125rem, 1.05rem + 0.45vw, 1.375rem)",
          "$type": "dimension"
        },
        "lg": {
          "$value": "clamp(1.375rem, 1.15rem + 0.9vw, 1.85rem)",
          "$type": "dimension"
        },
        "xl": {
          "$value": "clamp(1.85rem, 1.35rem + 1.6vw, 2.75rem)",
          "$type": "dimension"
        },
        "2xl": {
          "$value": "clamp(2.35rem, 1.55rem + 2.4vw, 3.5rem)",
          "$type": "dimension"
        }
      },
      "rotulo": {
        "$value": "0.65rem",
        "$type": "dimension"
      },
      "alturaLinha": {
        "aperto": { "$value": "1.15", "$type": "number" },
        "corpo": { "$value": "1.7", "$type": "number" }
      },
      "tracking": {
        "rotulo": { "$value": "0.14em", "$type": "dimension" },
        "rotuloLargo": { "$value": "0.18em", "$type": "dimension" },
        "hero": { "$value": "0.3em", "$type": "dimension" }
      },
      "peso": {
        "regular": {
          "$value": "400",
          "$type": "fontWeight",
          "$description": "Source Serif 4 corpo"
        },
        "semibold": {
          "$value": "600",
          "$type": "fontWeight",
          "$description": "Source Serif 4 ênfase"
        },
        "bold": {
          "$value": "700",
          "$type": "fontWeight",
          "$description": "Montserrat display/rótulos"
        },
        "extrabold": {
          "$value": "800",
          "$type": "fontWeight",
          "$description": "Montserrat títulos fortes"
        }
      },
      "estilo": {
        "normal": { "$value": "normal", "$type": "string" },
        "italico": {
          "$value": "italic",
          "$type": "string",
          "$description": "Source Serif 4 itálico (400i)"
        }
      }
    },
    "espacamento": {
      "0": { "$value": "0", "$type": "dimension" },
      "1": { "$value": "0.25rem", "$type": "dimension" },
      "2": { "$value": "0.5rem", "$type": "dimension" },
      "3": { "$value": "0.75rem", "$type": "dimension" },
      "4": { "$value": "1rem", "$type": "dimension" },
      "5": { "$value": "1.25rem", "$type": "dimension" },
      "6": { "$value": "1.5rem", "$type": "dimension" },
      "8": { "$value": "2rem", "$type": "dimension" },
      "10": { "$value": "2.5rem", "$type": "dimension" },